{
  "$schema": "/course-manifest.schema.json",
  "schema_version": 1,
  "course": {
    "name": "Heuristic Learning",
    "language": "zh-CN",
    "verification_command": "npm run verify",
    "structure_check_command": "npm run course:structure:check"
  },
  "core_pages": [
    {
      "id": "syllabus",
      "title": "课程大纲",
      "path": "docs/zh-cn/syllabus/index.md",
      "route": "/zh-cn/syllabus/"
    },
    {
      "id": "course-map",
      "title": "课程地图",
      "path": "docs/zh-cn/course-map/index.md",
      "route": "/zh-cn/course-map/"
    },
    {
      "id": "learning-loop",
      "title": "学习闭环",
      "path": "docs/zh-cn/theory/learning-loop.md",
      "route": "/zh-cn/theory/learning-loop"
    },
    {
      "id": "research-framework",
      "title": "研究框架",
      "path": "docs/zh-cn/theory/research-framework.md",
      "route": "/zh-cn/theory/research-framework"
    },
    {
      "id": "research-propositions",
      "title": "研究命题",
      "path": "docs/zh-cn/theory/research-propositions.md",
      "route": "/zh-cn/theory/research-propositions"
    },
    {
      "id": "examples",
      "title": "可运行示例",
      "path": "docs/zh-cn/examples/index.md",
      "route": "/zh-cn/examples/"
    },
    {
      "id": "x-signal",
      "title": "X 线索案例",
      "path": "docs/zh-cn/cases/x-signal/index.md",
      "route": "/zh-cn/cases/x-signal/"
    },
    {
      "id": "source-registry",
      "title": "来源登记",
      "path": "docs/zh-cn/appendix/source-registry.md",
      "route": "/zh-cn/appendix/source-registry"
    },
    {
      "id": "source-to-case-playbook",
      "title": "来源到案例 Playbook",
      "path": "docs/zh-cn/appendix/source-to-case-playbook.md",
      "route": "/zh-cn/appendix/source-to-case-playbook"
    },
    {
      "id": "release-checklist",
      "title": "发布清单",
      "path": "docs/zh-cn/appendix/release-checklist.md",
      "route": "/zh-cn/appendix/release-checklist"
    },
    {
      "id": "local-setup",
      "title": "本地运行与排错",
      "path": "docs/zh-cn/appendix/local-setup.md",
      "route": "/zh-cn/appendix/local-setup"
    },
    {
      "id": "troubleshooting-tree",
      "title": "排错决策树",
      "path": "docs/zh-cn/appendix/troubleshooting-tree.md",
      "route": "/zh-cn/appendix/troubleshooting-tree"
    },
    {
      "id": "glossary",
      "title": "术语表",
      "path": "docs/zh-cn/appendix/glossary.md",
      "route": "/zh-cn/appendix/glossary"
    },
    {
      "id": "references",
      "title": "参考文献与参考仓库",
      "path": "docs/zh-cn/appendix/references.md",
      "route": "/zh-cn/appendix/references"
    },
    {
      "id": "reading-guide",
      "title": "文献阅读指南",
      "path": "docs/zh-cn/appendix/reading-guide.md",
      "route": "/zh-cn/appendix/reading-guide"
    },
    {
      "id": "course-patterns",
      "title": "教学仓库对标矩阵",
      "path": "docs/zh-cn/appendix/course-patterns.md",
      "route": "/zh-cn/appendix/course-patterns"
    },
    {
      "id": "case-registry",
      "title": "案例矩阵",
      "path": "docs/zh-cn/appendix/case-registry.md",
      "route": "/zh-cn/appendix/case-registry"
    },
    {
      "id": "code-tour",
      "title": "代码导览",
      "path": "docs/zh-cn/appendix/code-tour.md",
      "route": "/zh-cn/appendix/code-tour"
    },
    {
      "id": "learning-units",
      "title": "学习单元矩阵",
      "path": "docs/zh-cn/appendix/learning-units.md",
      "route": "/zh-cn/appendix/learning-units"
    },
    {
      "id": "learning-outcomes",
      "title": "学习成果矩阵",
      "path": "docs/zh-cn/appendix/learning-outcomes.md",
      "route": "/zh-cn/appendix/learning-outcomes"
    },
    {
      "id": "checkpoints",
      "title": "阶段检查点",
      "path": "docs/zh-cn/appendix/checkpoints.md",
      "route": "/zh-cn/appendix/checkpoints"
    },
    {
      "id": "evaluation-metrics",
      "title": "评估指标矩阵",
      "path": "docs/zh-cn/appendix/evaluation-metrics.md",
      "route": "/zh-cn/appendix/evaluation-metrics"
    },
    {
      "id": "paper-blueprint",
      "title": "论文蓝图",
      "path": "docs/zh-cn/appendix/paper-blueprint.md",
      "route": "/zh-cn/appendix/paper-blueprint"
    },
    {
      "id": "speaker-notes",
      "title": "讲者备注",
      "path": "docs/zh-cn/appendix/speaker-notes.md",
      "route": "/zh-cn/appendix/speaker-notes"
    },
    {
      "id": "concept-graph",
      "title": "概念图谱",
      "path": "docs/zh-cn/appendix/concept-graph.md",
      "route": "/zh-cn/appendix/concept-graph"
    },
    {
      "id": "teaching-pack",
      "title": "授课包",
      "path": "docs/zh-cn/appendix/teaching-pack.md",
      "route": "/zh-cn/appendix/teaching-pack"
    },
    {
      "id": "citation",
      "title": "引用与署名",
      "path": "docs/zh-cn/appendix/citation.md",
      "route": "/zh-cn/appendix/citation"
    },
    {
      "id": "contribution-protocol",
      "title": "贡献与研究协议",
      "path": "docs/zh-cn/appendix/contribution-protocol.md",
      "route": "/zh-cn/appendix/contribution-protocol"
    },
    {
      "id": "rubric",
      "title": "课程评分与验收 Rubric",
      "path": "docs/zh-cn/appendix/rubric.md",
      "route": "/zh-cn/appendix/rubric"
    },
    {
      "id": "instructor-guide",
      "title": "教师指南",
      "path": "docs/zh-cn/appendix/instructor-guide.md",
      "route": "/zh-cn/appendix/instructor-guide"
    },
    {
      "id": "course-schedule",
      "title": "课程进度表",
      "path": "docs/zh-cn/appendix/course-schedule.md",
      "route": "/zh-cn/appendix/course-schedule"
    },
    {
      "id": "completion-audit",
      "title": "完成度审计",
      "path": "docs/zh-cn/appendix/completion-audit.md",
      "route": "/zh-cn/appendix/completion-audit"
    },
    {
      "id": "public-entrypoints",
      "title": "机器可读入口",
      "path": "docs/zh-cn/appendix/public-entrypoints.md",
      "route": "/zh-cn/appendix/public-entrypoints"
    },
    {
      "id": "visual-verification",
      "title": "视觉与浏览器验收",
      "path": "docs/zh-cn/appendix/visual-verification.md",
      "route": "/zh-cn/appendix/visual-verification"
    },
    {
      "id": "reproducibility",
      "title": "可复现性检查清单",
      "path": "docs/zh-cn/appendix/reproducibility.md",
      "route": "/zh-cn/appendix/reproducibility"
    },
    {
      "id": "exercises",
      "title": "练习集",
      "path": "docs/zh-cn/appendix/exercises.md",
      "route": "/zh-cn/appendix/exercises"
    },
    {
      "id": "research-projects",
      "title": "研究课题",
      "path": "docs/zh-cn/appendix/research-projects.md",
      "route": "/zh-cn/appendix/research-projects"
    },
    {
      "id": "research-logbook",
      "title": "研究日志",
      "path": "docs/zh-cn/appendix/research-logbook.md",
      "route": "/zh-cn/appendix/research-logbook"
    },
    {
      "id": "ablation-plan",
      "title": "消融计划",
      "path": "docs/zh-cn/appendix/ablation-plan.md",
      "route": "/zh-cn/appendix/ablation-plan"
    },
    {
      "id": "artifact-gap-analysis",
      "title": "Artifact 差距分析",
      "path": "docs/zh-cn/appendix/artifact-gap-analysis.md",
      "route": "/zh-cn/appendix/artifact-gap-analysis"
    },
    {
      "id": "benchmark-protocol",
      "title": "实验协议",
      "path": "docs/zh-cn/appendix/benchmark-protocol.md",
      "route": "/zh-cn/appendix/benchmark-protocol"
    },
    {
      "id": "benchmark-results",
      "title": "Benchmark 结果摘要",
      "path": "docs/zh-cn/appendix/benchmark-results.md",
      "route": "/zh-cn/appendix/benchmark-results"
    },
    {
      "id": "research-roadmap",
      "title": "研究路线图",
      "path": "docs/zh-cn/appendix/research-roadmap.md",
      "route": "/zh-cn/appendix/research-roadmap"
    },
    {
      "id": "lecture-3",
      "title": "第 3 讲：失败类型与反遗忘",
      "path": "docs/zh-cn/slides/lecture-3/index.md",
      "route": "/zh-cn/slides/lecture-3/"
    },
    {
      "id": "lab-2",
      "title": "Lab 2：反遗忘审查",
      "path": "docs/zh-cn/slides/lab-2/index.md",
      "route": "/zh-cn/slides/lab-2/"
    }
  ],
  "examples": [
    {
      "id": "gridworld",
      "title": "GridWorld",
      "source_status": "teaching-minimal",
      "failure_mode": "local_greedy_trap",
      "example_dir": "examples/heuristic-gridworld",
      "run_script": "examples:gridworld",
      "feedback_script": "examples:gridworld:feedback",
      "report": "experiments/gridworld/latest.json",
      "test": "tests/test_gridworld.py",
      "readme": "examples/heuristic-gridworld/README.md"
    },
    {
      "id": "ant-gait-replay",
      "title": "Ant Gait Replay",
      "source_status": "reproduced-lightweight-artifact",
      "failure_mode": "yaw_drift",
      "example_dir": "examples/ant-gait-replay",
      "run_script": "examples:ant-gait-replay",
      "feedback_script": "examples:ant-gait-replay:feedback",
      "report": "experiments/ant-gait-replay/latest.json",
      "test": "tests/test_ant_gait_replay.py",
      "readme": "examples/ant-gait-replay/README.md"
    },
    {
      "id": "breakout-replay",
      "title": "Breakout Replay",
      "source_status": "reproduced-lightweight-artifact",
      "failure_mode": "missed_after_wall_reflection",
      "example_dir": "examples/breakout-replay",
      "run_script": "examples:breakout-replay",
      "feedback_script": "examples:breakout-replay:feedback",
      "report": "experiments/breakout-replay/latest.json",
      "test": "tests/test_breakout_replay.py",
      "readme": "examples/breakout-replay/README.md"
    },
    {
      "id": "robot-soccer",
      "title": "Robot Soccer",
      "source_status": "reproduced-minimal-internal-signal",
      "failure_mode": "blocked_shot",
      "example_dir": "examples/robot-soccer",
      "run_script": "examples:robot-soccer",
      "feedback_script": "examples:robot-soccer:feedback",
      "report": "experiments/robot-soccer/latest.json",
      "test": "tests/test_robot_soccer.py",
      "readme": "examples/robot-soccer/README.md"
    },
    {
      "id": "vizdoom-replay",
      "title": "VizDoom Replay",